{
  "schema_version": "1.0.0",
  "scope": "poolside-p4-formal-execution",
  "decision": "approved-for-p4-formal-execution",
  "experiment_id": "poolside-laguna-p4-20261023",
  "formal_plan_sha256": "4b4d5bb3a8a23801ad31bf5ba6e27cca4e9c47c4fc579c08079d39461277267e",
  "budget_sha256": "0944ae8e15f2c914758e546d1408148d55df7780e76b43141d8c4ab233e48aae",
  "protocol_sha256": "f08249f0cba6f45d01d87e560d9ef472430ab8484bcf565b8515bf63d874bf1b",
  "release_manifest_sha256": "e7c85690dabb3913e9e971571c48d32b7e90155df37f327dd467285db113597e",
  "maximum_spend_usd": 0,
  "formal_execution_approval": true,
  "authority": {
    "role": "researcher",
    "basis": "explicit-user-approval",
    "approved_at_local": "2026-10-23T17:59:26+07:00",
    "quote": "Saya menyetujui eksekusi formal recovery2 dengan batas USD 0, reset database DVWA lokal, dan release hash e7c85690dabb3913e9e971571c48d32b7e90155df37f327dd467285db113597e."
  }
}
